imdb_id,title,plot,type,rated,year,released_at,added_at,runtime,genre,director,writer,actors,language,country,awards,metascore,imdb_rating,imdb_votes
tt0313680,Tarzan & Jane,"After being married an entire year, Jane thinks back on some of her and Tarzan's adventures as she searches for something special to mark the occasion with.",movie,G,2002,23 Jul 2002,"November 12, 2019",75 min,"Animation, Adventure, Family","Steve Loter, Victor Cook, Don MacKinnon, Lisa Schaffer(co-director)","Edgar Rice Burroughs (""Tarzan"" stories), Bill Motz, Bob Roth, Mirith J. Colao, John Behnke, Rob Humphrey, Jim Peterson, Jess Winfield, Jess Winfield (story), Dave Bullock (story), Adam Van Wyk (story)","Michael T. Weiss, Olivia d'Abo, Jeff Bennett, Jim Cummings",English,USA,4 nominations.,N/A,5.4,"5,264"
tt0350194,Teacher's Pet,"Spot (Lane) is a dog who can talk and read. Posing as a human, he sneaks into school with his master Leonard (Flemming). Educational adventures ensue.",movie,PG,2004,16 Jan 2004,"November 12, 2019",73 min,"Animation, Adventure, Comedy, Family, Fantasy, Musical, Sci-Fi",Timothy Björklund,"Gary Baseman (television series Teacher's Pet), Bill Steinkellner (television series Teacher's Pet), Cheri Steinkellner (television series Teacher's Pet), Bill Steinkellner (screenplay), Cheri Steinkellner (screenplay)","Nathan Lane, Kelsey Grammer, Shaun Fleming, Debra Jo Rupp",English,USA,2 nominations.,74,5.8,"1,471"
tt0257325,Teacher's Pet,"Envying the life of his eight-year-old master, a talking dog disguises himself as a human boy in order to go to school with him, and he becomes the big mutt on campus.",series,TV-Y,2000–2005,01 Sep 2000,"November 12, 2019",30 min,"Animation, Short, Adventure, Comedy, Family, Fantasy",N/A,"Gary Baseman, Bill Steinkellner, Cheri Steinkellner","Shaun Fleming, Nathan Lane",English,USA,8 wins & 4 nominations.,N/A,6.4,378
tt3764966,Teen Beach 2,"Modern day teens Mack and Brady get a real world visit from Lela, Tanner, Butchy, and other surfer and biker pals from the beach party film within a film, Wet Side Story.",movie,TV-G,2015,26 Jun 2015,"November 12, 2019",104 min,"Family, Fantasy, Musical",Jeffrey Hornaday,"Matt Eddy (teleplay by), Billy Eddy (teleplay by), Dan Berendsen (story by), Robert Horn (story by), Vince Marcello (based on characters created by), Mark Landry (based on characters created by)","Ross Lynch, Maia Mitchell, Gracie Gillam, Garrett Clayton",English,USA,2 wins & 3 nominations.,N/A,6.1,"3,331"
tt2325989,Teen Beach Movie,"Two surfing lovers, whose doomed relationship is nearing to a close, find themselves swept into a dimension-traversing wave that sends them into a beach movie musical in the 60's.",movie,Not Rated,2013,19 Jul 2013,"November 12, 2019",110 min,"Family, Fantasy, Musical",Jeffrey Hornaday,"Vince Marcello (story by), Mark Landry (story by), Vince Marcello (teleplay by), Mark Landry (teleplay by), Robert Horn (teleplay by)","Ross Lynch, Maia Mitchell, Gracie Gillam, Garrett Clayton",English,USA,2 nominations.,N/A,5.9,"8,886"
tt1845866,Teen Spirit,"The story is about Amber, a mean popular girl who gets electrocuted and dies and is not allowed to enter into heaven unless she helps the least popular girl in school become Prom Queen within a week, but things do not go as planned.",movie,TV-PG,2011,07 Aug 2011,"November 12, 2019",82 min,"Comedy, Drama, Fantasy",Gil Junger,"David Kendall (teleplay), Kathryn McCullough (story and teleplay), Bob Young (teleplay)","Cassandra Scerbo, Carissa Capobianco, Gabriela Lopez, Katrina Rose Tandy",English,USA,N/A,N/A,5.5,"6,775"
tt0120317,That Darn Cat,"A maid is kidnapped and scratches a message onto D.C. the cat's collar and when his owner Patti discovers this, she plays amateur detective with the help of D.C. to try to find the culprits.",movie,PG,1997,14 Feb 1997,"November 12, 2019",89 min,"Action, Comedy, Crime, Family, Mystery",Bob Spiers,"Gordon Gordon (novel), Mildred Gordon (novel), Gordon Gordon, Mildred Gordon, Bill Walsh, Scott Alexander (screenplay), Larry Karaszewski (screenplay)","Christina Ricci, Doug E. Doug, Dean Jones, George Dzundza",English,USA,2 nominations.,36,4.7,"3,952"
tt0059793,That Darn Cat!,"After a kidnapped bank teller uses a neighbor's wandering cat to send an S.O.S., the F.B.I. assigns a cat-allergic Agent to the case.",movie,Approved,1965,02 Dec 1965,"November 12, 2019",116 min,"Comedy, Crime, Family, Thriller",Robert Stevenson,"Gordon Gordon (screenplay), Mildred Gordon (screenplay), Bill Walsh (screenplay), Gordon Gordon (book), Mildred Gordon (book)","Hayley Mills, Dean Jones, Dorothy Provine, Roddy McDowall","English, French",USA,6 nominations.,71,6.8,"5,542"
tt0300865,That's So Raven,"A teenage girl periodically receives brief psychic visions of the near future. Trying to make these visions come true results in trouble, and hilarious situations, for the girl and her friends.",series,TV-G,2003–2007,17 Jan 2003,"October 1, 2019",30 min,"Comedy, Family, Fantasy",N/A,"Michael Poryes, Susan Sherman","Raven-Symoné, Orlando Brown, Kyle Massey, Anneliese van der Pol",English,USA,Nominated for 2 Primetime Emmys. Another 14 wins & 29 nominations.,N/A,6.5,"16,953"
tt0054594,The Absent Minded Professor,A college professor invents an anti-gravity substance which a corrupt businessman wants for himself.,movie,Approved,1961,16 Mar 1961,"November 12, 2019",92 min,"Comedy, Family, Sci-Fi, Sport",Robert Stevenson,"Bill Walsh (screenplay), Samuel W. Taylor (story)","Fred MacMurray, Nancy Olson, Keenan Wynn, Tommy Kirk",English,USA,Nominated for 3 Oscars. Another 1 win & 5 nominations.,75,6.8,"6,856"
,,,,,,,"November 12, 2019",,,,,,,,,,,
tt0061333,The Adventures of Bullwhip Griffin,"A young man from Boston heads west to join the California gold rush with the hopes of restoring his family fortune, but his dedicated butler sets out to find him and bring him home.",movie,Approved,1967,08 Mar 1967,"November 12, 2019",108 min,"Action, Adventure, Comedy, Family, Romance, Western",James Neilson,"Lowell S. Hawley (screenplay), Albert Sidney Fleischman (novel)","Roddy McDowall, Suzanne Pleshette, Karl Malden, Harry Guardino",English,USA,N/A,N/A,6.6,603
tt0106223,The Adventures of Huck Finn,"In Missouri, during the 1840s, young Huck Finn fearful of his drunkard father and yearning for adventure, leaves his foster family and joins with runaway slave Jim in a voyage down the Mississippi River toward slavery free states.",movie,PG,1993,02 Apr 1993,"November 12, 2019",108 min,"Adventure, Comedy, Drama, Family",Stephen Sommers,"Mark Twain (novel), Stephen Sommers (screenplay)","Elijah Wood, Courtney B. Vance, Robbie Coltrane, Jason Robards","English, French",USA,N/A,N/A,6.2,"7,451"
tt0041094,The Adventures of Ichabod and Mr. Toad,"An animated adaptation of ""The Wind in the Willows"" followed by an adaptation of ""The Legend of Sleepy Hollow"".",movie,Approved,1949,06 Jan 1950,"November 12, 2019",68 min,"Animation, Comedy, Family, Fantasy, Horror","James Algar, Clyde Geronimi, Jack Kinney","Washington Irving (story ""The Legend of Sleepy Hollow""), Kenneth Grahame (story ""The Wind in the Willows""), Erdman Penner (story), Winston Hibler (story), Joe Rinaldi (story), Ted Sears (story), Homer Brightman (story), Harry Reeves (story)","Bing Crosby, Basil Rathbone, Eric Blore, J. Pat O'Malley",English,USA,N/A,74,7.0,"11,917"
tt0047775,The Adventures of Spin and Marty,N/A,series,N/A,1955–,04 Nov 1955,"November 12, 2019",N/A,"Adventure, Western, Family",N/A,N/A,"Dee Aaker, Tim Considine, David Stollery, Roy Barcroft",English,USA,N/A,N/A,8.2,166
tt0047803,The African Lion,The Milotte's spend three years in Africa filming a lion.,movie,Approved,1955,14 Sep 1955,"November 12, 2019",75 min,"Family, Documentary",James Algar,"James Algar, Winston Hibler, Ted Sears, Jack Moffitt",Winston Hibler,English,USA,3 wins.,N/A,7.3,286
tt0072653,The Apple Dumpling Gang,Three orphan children strike gold in 1878 California.,movie,G,1975,01 Jul 1975,"November 12, 2019",100 min,"Comedy, Family, Western",Norman Tokar,"Don Tait (screenplay), Jack M. Bickham (book)","Bill Bixby, Susan Clark, Don Knotts, Tim Conway",English,USA,N/A,59,6.5,"4,710"
tt0078790,The Apple Dumpling Gang Rides Again,"The adventures of two idiotic outlaw wannabees, Amos and Theodore.",movie,G,1979,27 Jun 1979,"November 12, 2019",88 min,"Comedy, Family, Western",Vincent McEveety,Don Tait,"Tim Conway, Don Knotts, Tim Matheson, Kenneth Mars",English,USA,N/A,37,6.1,"2,270"
tt0065421,The Aristocats,"With the help of a smooth talking tomcat, a family of Parisian felines set to inherit a fortune from their owner try to make it back home after a jealous butler kidnaps them and leaves them in the country.",movie,G,1970,24 Dec 1970,"November 12, 2019",78 min,"Animation, Adventure, Comedy, Family, Musical",Wolfgang Reitherman,"Larry Clemmons (story), Vance Gerry (story), Ken Anderson (story), Frank Thomas (story), Eric Cleworth (story), Julius Svendsen (story), Ralph Wright (story), Tom McGowan (based on a story by), Tom Rowe (based on a story by)","Phil Harris, Eva Gabor, Sterling Holloway, Scatman Crothers",English,USA,3 wins.,66,7.1,"89,029"
tt0033356,The Art of Skiing,"Goofy, staying at the Sugar Bowl resort, demonstrates the basics of downhill skiing, which the titles and announcer insist is pronounced ""SHEEing"". The equipment is, of course, of the era. ...",movie,Approved,1941,14 Nov 1941,"November 12, 2019",8 min,"Animation, Short, Comedy, Family, Sport","Jack Kinney, Bill Roberts",N/A,"George Johnson, John McLeish, Hannes Schroll",English,USA,N/A,N/A,7.3,"1,061"
tt1626038,The Avengers: Earth's Mightiest Heroes,"After 74 villains break out of prison, Marvel's most powerful superheroes team up to capture all of them, and also to defend the Earth from widespread threats.",series,TV-Y7,2010–2012,22 Sep 2010,"November 12, 2019",30 min,"Animation, Action, Family, Sci-Fi",N/A,N/A,"Eric Loomis, Colleen O'Shaughnessey, Brian Bloom, Rick D. Wasserman",English,USA,8 nominations.,N/A,8.3,"12,505"
tt0203247,Avengers: United They Stand,The adventures of the Marvel Comics Universe's greatest general membership superhero team.,series,TV-Y7,1999–2000,30 Oct 1999,"November 12, 2019",30 min,"Animation, Action, Adventure, Sci-Fi",N/A,"Jack Kirby, Stan Lee","Linda Ballantyne, Tony Daniels, Ron Rubin, Martin Roach",English,"France, Canada, USA",N/A,N/A,5.5,682
tt0026094,The Band Concert,Mickey and his band are determined to perform their music despite the interferance of Donald Duck and a powerful storm.,movie,TV-Y7,1935,23 Feb 1935,"November 12, 2019",9 min,"Animation, Short, Comedy, Family, Music",Wilfred Jackson,N/A,Clarence Nash,English,USA,1 win.,N/A,7.9,"2,714"
tt0071199,The Bears and I,A man seeking peace and quiet finds himself father to three bears.,movie,G,1974,31 Jul 1974,"November 12, 2019",89 min,"Drama, Family",Bernard McEveety,"John Whedon (screenplay), Robert Franklin Leslie (novel), Jack Speirs (narration)","Patrick Wayne, Chief Dan George, Andrew Duggan, Michael Ansara",English,USA,N/A,N/A,6.2,253
tt3691740,The BFG,"An orphan little girl befriends a benevolent giant who takes her to Giant Country, where they attempt to stop the man-eating giants that are invading the human world.",movie,PG,2016,01 Jul 2016,"November 12, 2019",117 min,"Adventure, Family, Fantasy",Steven Spielberg,"Melissa Mathison (screenplay by), Roald Dahl (based on the book by)","Mark Rylance, Ruby Barnhill, Penelope Wilton, Jemaine Clement",English,"USA, India, UK",4 wins & 25 nominations.,66,6.4,"73,906"
tt0024886,The Big Bad Wolf,"The two foolish little pigs escort Red Riding Hood on a short cut through the woods, against the advice of their bricklayer brother. When they encounter the wolf, Red runs ahead to granny's...",movie,Approved,1934,14 Apr 1934,"November 12, 2019",9 min,"Animation, Comedy, Family, Musical, Short",Burt Gillett,N/A,"Sara Berner, Billy Bletcher, Pinto Colvig, Dorothy Compton",English,USA,N/A,N/A,7.1,"1,381"
tt0068276,The Biscuit Eater,"In this touching adventure, a remake of the popular 1940 film, two Georgia boys ignore their racial differences to team up and befriend a feral bird dog, whom they train to participate in a field trials.",movie,G,1972,22 Mar 1972,"November 12, 2019",90 min,"Drama, Family",Vincent McEveety,"James Street (story), Lawrence Edward Watkin","Earl Holliman, Pat Crowley, Lew Ayres, Godfrey Cambridge",English,USA,N/A,N/A,5.7,281
tt0088814,The Black Cauldron,A young boy and a bunch of misfit friends embark on a quest to find a dark magic item of ultimate power before a diabolical tyrant can.,movie,PG,1985,24 Jul 1985,"November 12, 2019",80 min,"Animation, Action, Adventure, Family, Fantasy, Horror","Ted Berman, Richard Rich","Lloyd Alexander (novel), David Jonas (story), Vance Gerry (story), Ted Berman (story), Richard Rich (story), Al Wilson (story), Roy Morita (story), Peter Young (story), Art Stevens (story), Joe Hale (story), Rosemary Anne Sisson (additional dialogue), Roy Edward Disney (additional dialogue), Tony Marino (additional story contributions), Steve Hulett (additional story contributions), Mel Shaw (additional story contributions), Burny Mattinson (additional story contributions), John Musker (additional story contributions), Ron Clements (additional story contributions), Doug Lefler (additional story contributions)","Grant Bardsley, Susan Sheridan, Freddie Jones, Nigel Hawthorne","English, Portuguese","USA, UK",N/A,59,6.4,"29,395"
tt0078869,The Black Hole,"A research vessel finds a missing ship, commanded by a mysterious scientist, on the edge of a black hole.",movie,PG,1979,21 Dec 1979,"November 12, 2019",98 min,"Action, Sci-Fi",Gary Nelson,"Jeb Rosebrook (story by), Bob Barbash (story by), Richard H. Landau (story by), Jeb Rosebrook (screenplay by), Gerry Day (screenplay by)","Maximilian Schell, Anthony Perkins, Robert Forster, Joseph Bottoms",English,USA,Nominated for 2 Oscars. Another 6 nominations.,52,6.0,"22,422"
tt2616880,The Blue Umbrella,"Amidst the rain in a singing city, two umbrellas - one blue, one not - fall eternally in love.",movie,G,2013,21 Jun 2013,"November 12, 2019",7 min,"Animation, Short, Family, Fantasy, Romance",Saschka Unseld,Saschka Unseld,Sarah Jaffe,English,USA,1 nomination.,N/A,7.6,"8,311"
,,,,,,,"November 12, 2019",,,,,,,,,,,
tt0274240,The Book of Pooh,"A new Disney version of the classic children's stories about Winnie the Pooh and his friends. Rather than the animated versions of the past, this series is done entirely in a puppet format....",series,TV-Y,2001–2004,22 Jan 2001,"November 12, 2019",30 min,"Animation, Short, Adventure, Comedy, Family, Musical",N/A,N/A,"Roger Jackson, John Fiedler, Jim Cummings, Ken Sansom",English,USA,1 win & 3 nominations.,N/A,6.3,412
tt0072728,The Boy Who Talked to Badgers,A young boy gets along better with the animals he befriends around his family's Canadian farm than with the people he lives with.,movie,N/A,1975,14 Sep 1975,"April 3, 2020",N/A,"Adventure, Family",Gary Nelson,N/A,"Christian Juttner, Carl Betz, Salome Jens, Denver Pyle",English,USA,N/A,N/A,6.8,25
tt0147926,The Brave Little Toaster Goes to Mars,"Thomas M. Disch's sequel, based on the book sequel, has our heroes zooming off to, of all places, Mars.",movie,Not Rated,1998,18 May 1998,"November 12, 2019",73 min,"Animation, Adventure, Family, Sci-Fi","Robert C. Ramirez, Patrick A. Ventura","Willard Carroll (screenplay), Thomas M. Disch (novel)","Thurl Ravenscroft, Deanna Oliver, Eric Lloyd, Timothy Stack",English,USA,2 nominations.,N/A,5.7,"1,333"
tt0071288,The Castaway Cowboy,"A Texas cowboy is rescued at sea by a 12-year-old boy. While he waits to return home, he decides to help out his rescuer's family.",movie,G,1974,01 Aug 1974,"November 12, 2019",91 min,"Comedy, Family, Western",Vincent McEveety,"Don Tait (story & screenplay), Richard M. Bluel (story), Hugh Benson (story)","James Garner, Vera Miles, Robert Culp, Eric Shea",English,USA,N/A,N/A,5.9,421
tt0077305,The Cat from Outer Space,"Three scientists help an Alien feline, stranded on Earth, to repair its damaged spacecraft in order to return home but their efforts are hampered by inept army officials and foreign spies.",movie,G,1978,09 Jun 1978,"October 1, 2019",104 min,"Comedy, Family, Sci-Fi",Norman Tokar,Ted Key,"Ken Berry, Sandy Duncan, Harry Morgan, Roddy McDowall",English,USA,1 nomination.,58,6.1,"4,162"
tt0338852,The Cheetah Girls,Four teens aim to take the world by storm with their music.,movie,TV-G,2003,15 Aug 2003,"November 12, 2019",100 min,"Comedy, Drama, Family, Music, Musical",Oz Scott,"Deborah Gregory (series of books), Alison Taylor","Raven-Symoné, Adrienne Houghton, Kiely Williams, Sabrina Bryan","English, Spanish","Canada, USA",6 nominations.,N/A,4.8,"6,690"
tt0800318,The Cheetah Girls 2,"The girl group return for more adventures, this time traveling to Spain to take part in a music festival.",movie,TV-G,2006,25 Aug 2006,"November 12, 2019",96 min,"Comedy, Drama, Family, Music, Musical",Kenny Ortega,"Bethesda Brown, Alison Taylor, Deborah Gregory (series of books)","Raven-Symoné, Adrienne Houghton, Sabrina Bryan, Kiely Williams","English, Spanish",USA,2 nominations.,N/A,5.0,"5,512"
tt1013542,The Cheetah Girls: One World,The girl group travel to India to star in a Bollywood movie - but end up competing for the same part.,movie,TV-G,2008,22 Aug 2008,"November 12, 2019",90 min,"Comedy, Drama, Family, Musical",Paul Hoen,"Dan Berendsen (story by), Dan Berendsen (teleplay by), Nisha Ganatra (teleplay by), Deborah Gregory (series of books), Jen Small (teleplay by)","Adrienne Houghton, Sabrina Bryan, Kiely Williams, Roshan Seth",English,USA,2 nominations.,N/A,4.7,"3,779"
tt0090840,The Christmas Star,A counterfeiter finds the true meaning of the holidays.,movie,TV-G,1986,14 Dec 1986,"November 12, 2019",94 min,"Drama, Family",Alan Shapiro,"Carol Dysinger, Alan Shapiro (story), Alan Shapiro, Alan Shapiro","Edward Asner, Rene Auberjonois, Jim Metzler, Susan Tyrrell",English,"Canada, USA",N/A,N/A,6.5,345
tt0499448,The Chronicles of Narnia: Prince Caspian,"The Pevensie siblings return to Narnia, where they are enlisted to once again help ward off an evil king and restore the rightful heir to the land's throne, Prince Caspian.",movie,PG,2008,16 May 2008,"November 12, 2019",150 min,"Action, Adventure, Family, Fantasy",Andrew Adamson,"Andrew Adamson (screenplay), Christopher Markus (screenplay), Stephen McFeely (screenplay), C.S. Lewis (novel)","Ben Barnes, Georgie Henley, Skandar Keynes, William Moseley",English,"USA, Poland, Slovenia, Czech Republic, UK",2 wins & 20 nominations.,62,6.5,"187,627"
tt0363771,"The Chronicles of Narnia: The Lion, the Witch and the Wardrobe",Four kids travel through a wardrobe to the land of Narnia and learn of their destiny to free it with the guidance of a mystical lion.,movie,PG,2005,09 Dec 2005,"November 12, 2019",143 min,"Adventure, Family, Fantasy",Andrew Adamson,"Ann Peacock (screenplay), Andrew Adamson (screenplay), Christopher Markus (screenplay), Stephen McFeely (screenplay), C.S. Lewis (book)","Georgie Henley, Skandar Keynes, William Moseley, Anna Popplewell","English, German, Brazilian Sign Language","UK, USA",Won 1 Oscar. Another 17 wins & 46 nominations.,75,6.9,"353,342"
tt0213565,The Color of Friendship,A white South African girl finds herself in a difficult situation when she is sent to spend a term with a black family in America.,movie,TV-G,2000,05 Feb 2000,"November 12, 2019",87 min,"Biography, Drama, Family",Kevin Hooks,Paris Qualles,"Lindsey Haun, Shadia Simmons, Carl Lumbly, Penny Johnson Jerald",English,"Canada, USA",Won 1 Primetime Emmy. Another 4 wins & 3 nominations.,N/A,7.4,"3,027"
tt0065566,The Computer Wore Tennis Shoes,"At Medfield College, an accident with a donated computer gives Dexter Riley the ability to remember any knowledge learned instantly and perfectly.",movie,G,1969,24 Dec 1969,"November 12, 2019",91 min,"Comedy, Family, Sci-Fi",Robert Butler,Joseph L. McEveety,"Kurt Russell, Cesar Romero, Joe Flynn, William Schallert",English,USA,N/A,54,6.0,"4,208"
tt0276033,The Country Bears,Beary Barrington goes on an adventure to save Country Bear Hall by getting the Country Bears back together for a reunion concert.,movie,G,2002,26 Jul 2002,"November 12, 2019",88 min,"Comedy, Family, Music, Musical",Peter Hastings,Mark Perez,"Haley Joel Osment, Diedrich Bader, Candy Ford, James Gammon",English,USA,4 nominations.,37,4.1,"4,769"
,,,,,,,"April 21, 2020",,,,,,,,,,,
,,,,,,,"May 11, 2020",,,,,,,,,,,
tt0120917,The Emperor's New Groove,"Emperor Kuzco is turned into a llama by his ex-administrator Yzma, and must now regain his throne with the help of Pacha, the gentle llama herder.",movie,G,2000,15 Dec 2000,"November 12, 2019",78 min,"Animation, Adventure, Comedy, Family, Fantasy",Mark Dindal,"Chris Williams (story by), Mark Dindal (story by), David Reynolds (screenplay by), Stephen J. Anderson (additional story material by), Don Hall (additional story material by), John Norton (additional story material by), Roger Allers (based on an original story by), Matthew Jacobs (based on an original story by), Doug Frankel (additional story), Mark Kennedy (additional story), Mark Walton (additional story)","David Spade, John Goodman, Eartha Kitt, Patrick Warburton",English,USA,Nominated for 1 Oscar. Another 7 wins & 26 nominations.,70,7.3,"171,721"
tt0327698,The Even Stevens Movie,"The Stevens think that they've won an all-expenses-paid trip to an island that's halfway around the world. When their house is destroyed, their food stolen, and their bacon eaten, the ...",movie,TV-G,2003,13 Jun 2003,"November 12, 2019",93 min,"Comedy, Family",Sean McNamara,"Dennis Rinsler, Marc Warren","Shia LaBeouf, Christy Carlson Romano, Donna Pescow, Tom Virtue",English,USA,1 win & 5 nominations.,N/A,6.2,"6,241"
tt2025690,The Finest Hours,The Coast Guard makes a daring rescue attempt off the coast of Cape Cod after a pair of oil tankers are destroyed during a blizzard in 1952.,movie,PG-13,2016,29 Jan 2016,"March 6, 2020",117 min,"Action, Drama, History, Thriller",Craig Gillespie,"Scott Silver (screenplay), Paul Tamasy (screenplay), Eric Johnson (screenplay), Casey Sherman (book), Michael J. Tougias (book)","Chris Pine, Casey Affleck, Ben Foster, Eric Bana",English,USA,2 wins.,58,6.8,"59,000"
tt9154632,The Flood,An in-depth look at the animals living in the heart of Africa's Okavango Delta.,movie,N/A,2018,25 Nov 2018,"November 12, 2019",N/A,Documentary,N/A,N/A,Angela Bassett,English,USA,N/A,N/A,8.2,24
tt0082406,The Fox and the Hound,Two childhood friends find themselves forced to become enemies.,movie,G,1981,10 Jul 1981,"November 12, 2019",83 min,"Animation, Adventure, Drama, Family","Ted Berman, Richard Rich, Art Stevens, David Hand, Wolfgang Reitherman","Daniel P. Mannix (based on the book by), Larry Clemmons (story), Ted Berman (story), David Michener (story), Peter Young (story), Burny Mattinson (story), Steve Hulett (story), Earl Kress (story), Vance Gerry (story)","Mickey Rooney, Kurt Russell, Pearl Bailey, Jack Albertson",English,USA,1 win & 2 nominations.,65,7.3,"81,227"
tt0465997,The Fox and the Hound 2,"Tod and Copper still go together like an itch and a scratch, but when Copper gets a shot at the big time with a nutty group of hound dog howlers, their purebred friendship is put to the test.",movie,G,2006,11 Dec 2006,"November 12, 2019",69 min,"Animation, Adventure, Comedy, Family, Musical",Jim Kammerud,"Rich Burns (screenplay by), Roger S.H. Schulman (screenplay by)","Reba McEntire, Patrick Swayze, Jonah Bobo, Harrison Fahn",English,USA,1 win.,N/A,5.3,"3,961"
tt0492956,The Game Plan,An NFL quarterback living the bachelor lifestyle discovers that he has an 8-year-old daughter from a previous relationship.,movie,PG,2007,28 Sep 2007,"November 12, 2019",110 min,"Comedy, Family, Sport",Andy Fickman,"Nichole Millard (screenplay), Kathryn Price (screenplay), Nichole Millard (story), Kathryn Price (story), Audrey Wells (story)","Dwayne Johnson, Madison Pettis, Kyra Sedgwick, Roselyn Sanchez",English,USA,3 nominations.,44,6.1,"56,291"
tt0080788,The Ghosts of Buxley Hall,Ghosts and a young cadet try to save a military academy from being closed.,movie,N/A,1980,21 Dec 1980,"November 12, 2019",120 min,"Comedy, Family, Fantasy",Bruce Bilson,"Sy Gomberg (adaptation), Rick Mittleman (adaptation), Sy Gomberg","Dick O'Neill, Victor French, Louise Latham, Rad Daly",English,USA,N/A,N/A,6.6,97
tt0025184,The Goddess of Spring,"The lovely goddess of spring Persephone is kidnapped by Hades, thus bringing about the winter season.",movie,APPROVED,1934,03 Nov 1934,"November 12, 2019",10 min,"Animation, Short, Family, Fantasy, Musical",Wilfred Jackson,N/A,"Kenny Baker, Jessica Dragonette, Tudor Williams",English,USA,N/A,N/A,6.9,483
tt0026423,The Golden Touch,"Greedy King Midas is granted his wish that everything he touches turns to gold. However, he realizes this may be a curse, when he sits down to eat and the food turns to gold as well.",movie,N/A,1935,22 Mar 1935,"November 12, 2019",10 min,"Animation, Short, Comedy, Family, Musical",Walt Disney,N/A,Billy Bletcher,English,USA,N/A,N/A,6.9,856
tt1979388,The Good Dinosaur,"In a world where dinosaurs and humans live side-by-side, an Apatosaurus named Arlo makes an unlikely human friend.",movie,PG,2015,25 Nov 2015,"November 12, 2019",93 min,"Animation, Adventure, Comedy, Drama, Family, Fantasy",Peter Sohn,"Bob Peterson (original concept & development by), Peter Sohn (story by), Erik Benson (story by), Meg LeFauve (story by), Kelsey Mann (story by), Bob Peterson (story by), Meg LeFauve (screenplay by), Peter Hedges (additional screenplay material by), Adrian Molina (additional screenplay material by)","Jeffrey Wright, Frances McDormand, Maleah Nipay-Padilla, Ryan Teeple",English,USA,Nominated for 1 Golden Globe. Another 9 wins & 40 nominations.,66,6.7,"97,413"
