imdb_id,title,plot,type,rated,year,released_at,added_at,runtime,genre,director,writer,actors,language,country,awards,metascore,imdb_rating,imdb_votes
tt6591446,Marvel Future Avengers,"follows a young boy named Makoto, who gains superpowers due to an evil gene manipulation experiment. Makoto and other young kids with powers join the Avengers as apprentices named ""Future Avengers.""",series,TV-PG,2017–,22 Jul 2017,"February 28, 2020",N/A,Animation,N/A,N/A,"Max Mittelman, Dina Sherman, Xander Mobus, Kirk Thornton",Japanese,N/A,N/A,N/A,6.0,75
tt4176370,Guardians of the Galaxy,The adventures of a band of space warriors who work to protect the universe from the evil overlord Thanos.,series,TV-Y7,2015–,26 Jul 2015,"November 12, 2019",22 min,"Animation, Action, Adventure, Comedy, Drama, Family, Sci-Fi",N/A,"Dan Abnett, Andy Lanning, Marty Isenberg, Henry Gilroy","Kevin Michael Richardson, Vanessa Marshall, David Sobolov, Will Friedle",English,USA,2 wins & 2 nominations.,N/A,7.4,"2,520"
,,,,,,,"November 12, 2019",,,,,,,,,,,
tt10163846,Marvel's Hero Project,"This 20-episode series shares the remarkable, positive change several young heroes are making in their own communities across the country. These inspiring kids have dedicated their lives to...",series,TV-G,2019–,12 Nov 2019,"November 12, 2019",N/A,Documentary,N/A,N/A,"Jordan Reeves, Daniella Benitez, Elijah Lee, Camron Reeves",English,USA,N/A,N/A,6.2,97
tt4154858,Inhumans,An isolated community of superhumans fight to protect themselves.,series,TV-PG,2017,29 Sep 2017,"November 12, 2019",43 min,"Action, Adventure, Sci-Fi",N/A,Scott Buck,"Anson Mount, Serinda Swan, Ken Leung, Eme Ikwuakor",English,USA,N/A,N/A,5.0,"20,672"
tt3221698,Iron Man & Hulk: Heroes United,The Invincible Iron Man and the Incredible Hulk must join forces to save the Earth from its greatest threat yet.,movie,PG,2013,03 Dec 2013,"February 16, 2020",71 min,"Animation, Action, Adventure, Family, Sci-Fi","Eric Radomski, Leo Riley","Henry Gilroy, Brandon Auman, Stan Lee (characters), Jack Kirby (characters), Larry Lieber (characters), Don Heck (characters)","Adrian Pasdar, Fred Tatasciore, Dee Bradley Baker, Robin Atkin Downes",English,USA,N/A,N/A,4.7,"2,012"
tt6603254,Rocket & Groot,Adventures of Rocket and Groot before their time on the Guardians of the Galaxy (2014) team.,series,N/A,2017–,10 Mar 2017,"November 12, 2019",N/A,"Animation, Short, Adventure, Sci-Fi",N/A,N/A,"Trevor Devall, Kevin Michael Richardson",N/A,N/A,N/A,N/A,7.0,160
tt1236246,Runaways,"After discovering their parents are super-villains in disguise, a group of teenagers band together to run away from their homes in order to atone for their parents' actions and to discover the secrets of their origins.",series,TV-14,2017–2019,21 Nov 2017,"November 12, 2019",60 min,"Action, Drama, Sci-Fi",N/A,"Stephanie Savage, Josh Schwartz","Rhenzy Feliz, Lyrica Okano, Virginia Gardner, Ariela Barer",English,USA,3 wins & 4 nominations.,N/A,7.0,"20,241"
tt6135682,Spider-Man,"Peter Parker, a new student at the famous Horizon High, fights evil super-villains as the costumed superhero, Spider-Man.",series,TV-Y7,2017–,29 Jul 2017,"November 12, 2019",21 min,"Animation, Short, Action, Adventure, Family, Sci-Fi",N/A,N/A,"Robbie Daymond, Nadji Jeter, Fred Tatasciore, Laura Bailey",English,USA,1 nomination.,N/A,6.1,"1,440"
,,,,,,,"November 12, 2019",,,,,,,,,,,
,,,,,,,"November 12, 2019",,,,,,,,,,,
tt0058331,Mary Poppins,"In turn of the century London, a magical nanny employs music and adventure to help two neglected children become closer to their father.",movie,G,1964,18 Jun 1965,"November 12, 2019",139 min,"Comedy, Family, Fantasy, Musical",Robert Stevenson,"Bill Walsh (screenplay), Don DaGradi (screenplay), P.L. Travers (based on: The ""Mary Poppins"" books by)","Julie Andrews, Dick Van Dyke, David Tomlinson, Glynis Johns",English,USA,Won 5 Oscars. Another 15 wins & 17 nominations.,88,7.8,"151,417"
tt0901686,Mater and the Ghostlight,"In this short featuring the characters of the movie Cars, Mater is told the story of a Ghostlight, which causes him to be scared.",movie,G,2006,25 Oct 2006,"November 12, 2019",7 min,"Animation, Short, Comedy, Family, Horror","John Lasseter, Dan Scanlon(co-director)","Joe Ranft (original story), John Lasseter (original story), Dan Scanlon (original story)","Larry the Cable Guy, Owen Wilson, Michael Wallis, Bonnie Hunt",English,USA,N/A,N/A,6.6,"7,151"
tt0120645,Meet the Deedles,Two surfers end up as Yellowstone park rangers and have to stop a former ranger who is out for revenge.,movie,PG,1998,27 Mar 1998,"November 12, 2019",93 min,"Comedy, Family",Steve Boyum,Jim Herzfeld,"Steve Van Wormer, Paul Walker, A.J. Langer, John Ashton",English,USA,1 win & 2 nominations.,N/A,4.1,"2,567"
tt0396555,Meet the Robinsons,"Lewis is a brilliant inventor who meets mysterious stranger named Wilbur Robinson, whisking Lewis away in a time machine and together they team up to track down Bowler Hat Guy in a showdown that ends with an unexpected twist of fate.",movie,G,2007,30 Mar 2007,"November 12, 2019",95 min,"Animation, Adventure, Comedy, Family, Sci-Fi",Stephen J. Anderson,"Jon Bernstein (screenplay by), Michelle Bochner Spitz (screenplay by), Don Hall (screenplay by), Nathan Greno (screenplay by), Aurian Redson (screenplay by), Joseph Mateo (screenplay by), Stephen J. Anderson (screenplay by), William Joyce (based upon the book ""A Day with Wilbur Robinson"" by), Diego Garzon (story editor)","Angela Bassett, Daniel Hansen, Jordan Fry, Matthew Josten",English,USA,1 win & 10 nominations.,61,6.8,"84,040"
tt0040580,Melody Time,An anthology of animated vignettes set to contemporary music.,movie,Approved,1948,27 May 1948,"November 12, 2019",75 min,"Animation, Comedy, Family, Musical","Clyde Geronimi, Wilfred Jackson, Jack Kinney, Hamilton Luske","Winston Hibler (story), Erdman Penner (story), Harry Reeves (story), Homer Brightman (story), Ken Anderson (story), Ted Sears (story), Joe Rinaldi (story), William Cottrell (story), Art Scott (story), Jesse Marsh (story), Bob Moore (story), John Walbridge (story), Hardie Gramatky (story ""Little Toot"")","Roy Rogers, Trigger, Dennis Day, The Andrews Sisters",English,USA,1 win.,69,6.4,"4,534"
,,,,,,,"November 12, 2019",,,,,,,,,,,
tt2768802,Mickey Mouse,Mickey Mouse takes on new adventures finding himself in silly situations in different settings.,series,TV-G,2013–,12 Mar 2013,"November 12, 2019",4 min,"Animation, Short, Comedy, Family",N/A,N/A,"Chris Diamantopoulos, Russi Taylor, Bill Farmer, Tony Anselmo",English,USA,Won 7 Primetime Emmys. Another 23 wins & 30 nominations.,N/A,8.1,"1,772"
tt0047757,The Mickey Mouse Club,Mickey Mouse hosts a youth oriented variety show.,series,TV-G,1955–1958,17 Jul 1955,"November 12, 2019",60 min,"Family, Comedy, Drama, Music",N/A,"Hal Adelquist, Walt Disney","Jimmie Dodd, Tommy Cole",English,USA,Won 1 Golden Globe. Another 1 nomination.,N/A,7.7,609
tt6264782,Mickey Mouse Mixed-Up Adventures,"Mickey Mouse and his pals Minnie, Pluto, Goofy, Daisy, and Donald take their unique transforming vehicles on humorous high-spirited races around the globe as well as hometown capers in Hot Dog Hills.",series,TV-Y,2017–,15 Jan 2017,"November 12, 2019",21 min,"Animation, Short, Adventure, Comedy, Family, Sport",N/A,"Vincent Chalvon-Demersay, David Michel, Jean-Louis Vandestoc","Bret Iwan, Russi Taylor, Bill Farmer, Tress MacNeille",English,USA,4 nominations.,N/A,6.2,335
tt0371823,"Mickey, Donald, Goofy: The Three Musketeers","Mickey, Donald and Goofy are the French three Musketeers.",movie,G,2004,17 Aug 2004,"November 12, 2019",68 min,"Animation, Adventure, Comedy, Family, Musical, Romance",Donovan Cook,"Evan Spiliotopoulos (screenplay), David Mickey Evans (screenplay), Robin Kingsland","Wayne Allwine, Tony Anselmo, Bill Farmer, Russi Taylor",English,USA,1 win & 5 nominations.,N/A,6.4,"7,496"
tt0035064,Mickey's Birthday Party,"The gang throws Mickey a surprise birthday party; his present is an electric organ, which Minnie plays while Mickey does a jazzy dance. Goofy bakes the cake, but keeps having trouble with ...",movie,Approved,1942,07 Feb 1942,"November 12, 2019",8 min,"Animation, Short, Comedy, Family",Riley Thomson,Warren Foster (story),"Thelma Boardman, Pinto Colvig, Walt Disney, Florence Gill",English,USA,N/A,N/A,6.6,607
tt0085936,Mickey's Christmas Carol,The classic Disney animated characters play the roles in this animated retelling of the Charles Dickens masterpiece.,movie,G,1983,16 Dec 1983,"November 12, 2019",26 min,"Animation, Short, Comedy, Family, Fantasy","Burny Mattinson, Richard Rich","Charles Dickens (based on the book: ""A Christmas Carol"" by), Burny Mattinson (story adaptation), Tony Marino (story adaptation), Ed Gombert (story adaptation), Don Griffith (story adaptation), Alan Young (story adaptation), Alan Dinehart (story adaptation)","Alan Young, Wayne Allwine, Hal Smith, Will Ryan",English,USA,N/A,N/A,8.1,"9,549"
,,,,,,,"November 12, 2019",,,,,,,,,,,
tt0238414,Mickey's Once Upon a Christmas,Mickey and his friends star in 3 heartwarming stories of Christmas past.,movie,Not Rated,1999,09 Nov 1999,"November 12, 2019",66 min,"Animation, Comedy, Family, Fantasy","Jun Falkenstein, Alex Mann, Bradley Raymond, Toby Shelton, Bill Speers","Charlie Cohen (screenplay), William Dean Howells (story inspired by: ""Christmas Every Day""), Scott Spencer Gorden (screenplay), Tom Nance (screenplay), Carter Crocker (screenplay), Richard Cray (screenplay), Temple Mathews (screenplay), O. Henry (story based on: ""The Gift of the Magi""), Thomas Hart (interstitial narration), Eddie Guzelian (interstitial narration), Alex Mann, Ross Hastings","Kelsey Grammer, Wayne Allwine, Russi Taylor, Tony Anselmo",English,USA,2 nominations.,N/A,7.2,"6,247"
tt0027964,Mickey's Rival,Minnie's old sweetheart Mortimer drops in while she and Mickey are out on a picnic.,movie,Approved,1936,20 Jun 1936,"November 12, 2019",8 min,"Animation, Short, Comedy, Family, Romance",Wilfred Jackson,N/A,"Sonny Dawson, Walt Disney, Marcellite Garner, Leone Le Doux",English,USA,N/A,N/A,6.9,533
tt0030448,Mickey's Trailer,"Mickey and his friends take a vacation in his house trailer equipped with all the latest modern conveniences. Heading up a steep mountain road with Goofy driving the car, surely nothing can go wrong.",movie,Not Rated,1938,06 May 1938,"November 12, 2019",8 min,"Animation, Short, Adventure, Comedy, Family",Ben Sharpsteen,N/A,"Walt Disney, Clarence Nash, Danny Webb",English,USA,N/A,N/A,7.9,"2,542"
tt0424279,Mickey's Twice Upon a Christmas,Sequel to Mickey's Once Upon a Christmas,movie,G,2004,09 Nov 2004,"November 12, 2019",68 min,"Animation, Comedy, Family, Fantasy","Carole Holliday, Matthew O'Callaghan, Theresa Cullen","Bill Motz (screenplay), Bob Roth (screenplay), Peggy Holmes (screenplay), Peggy Holmes (story), Chad Fiveash (screenplay), James Patrick Stoteraux (screenplay), Matthew O'Callaghan (screenplay), Chad Fiveash (story), James Patrick Stoteraux (story), Bill Motz (screenplay), Bob Roth (screenplay), Shirley Pierce (screenplay), Theresa Cullen (story), Jim Peronto (screenplay), Carole Holliday (screenplay), Carole Holliday (story), Michael Shipley (screenplay), Jim Bernstein (screenplay), Shirley Pierce (screenplay), Colin Goldman (story), Matthew O'Callaghan (story), Robin Kingsland","Wayne Allwine, Tony Anselmo, Jeff Bennett, Jim Cummings",English,USA,1 win & 3 nominations.,N/A,6.5,"3,756"
tt0120751,Mighty Joe Young,"A legendary fifteen-foot tall mountain gorilla named Joe is taken to an animal sanctuary in California by zoologist Gregg O'Hara (Bill Paxton) and Jill Young (Charlize Theron), with whom he grew up. Poacher Strasser (Rade Serbedzija) returns from the past to seek vengeance on Joe.",movie,PG,1998,25 Dec 1998,"November 12, 2019",114 min,"Action, Adventure, Family, Fantasy, Thriller",Ron Underwood,"Merian C. Cooper (story), Ruth Rose (earlier screenplay), Mark Rosenthal (screenplay), Lawrence Konner (screenplay)","Charlize Theron, Bill Paxton, Rade Serbedzija, Peter Firth","English, Swahili",USA,Nominated for 1 Oscar. Another 1 win & 3 nominations.,51,5.6,"26,795"
tt0323250,Mike's New Car,"Mike's bought a new 6-wheel-drive car, and he can't wait to show it off to Sulley. Only problem is, Mike hasn't exactly mastered the controls yet, and they're pretty complicated.",movie,Not Rated,2002,09 Aug 2002,"November 12, 2019",4 min,"Animation, Short, Comedy, Family, Fantasy","Pete Docter, Roger Gould","Pete Docter (original story), Jeff Pidgeon (story), Roger Gould (story), Rob Gibbs (story)","Billy Crystal, John Goodman",English,USA,N/A,N/A,7.1,"11,759"
tt3098856,Mission Force One,Follows the outer space voyages of young adventurer Miles and his family.,series,N/A,2015–,06 Feb 2015,"December 1, 2019",30 min,"Animation, Adventure, Family, Sci-Fi",N/A,Sascha Paladino,"Fiona Bishop, Dee Bradley Baker, Tom Kenny, Olivia Munn",English,USA,1 win & 4 nominations.,N/A,6.7,416
tt0366777,Millions,"Ethics, being human and the soul come to the fore when a 7-year old finds a bag of Pounds just days before the currency is switched to Euros and learns what we are really made of.",movie,PG-13,2004,29 Apr 2005,"November 12, 2019",98 min,"Comedy, Crime, Drama, Family",Danny Boyle,Frank Cottrell Boyce,"Alex Etel, Lewis McGibbon, James Nesbitt, Daisy Donovan",English,UK,2 wins & 7 nominations.,74,6.9,"24,147"
tt1072755,Minutemen,A comedy/sci-fi/adventure about three high school kids who invent a 10 minute time machine to spare others just like them from the humiliation they've endured.,movie,TV-G,2008,25 Jan 2008,"November 12, 2019",98 min,"Adventure, Comedy, Family, Sci-Fi",Lev L. Spiro,"John Killoran (teleplay), David Diamond (story), David Weissman (story)","Jason Dolley, Luke Benward, Nicholas Braun, Chelsea Kane",English,USA,5 nominations.,N/A,5.8,"5,182"
tt0349825,Miracle,"The true story of Herb Brooks, the player-turned-coach who led the 1980 U.S. Olympic hockey team to victory over the seemingly invincible Soviet squad.",movie,PG,2004,06 Feb 2004,"November 12, 2019",135 min,"Biography, Drama, History, Sport",Gavin O'Connor,Eric Guggenheim,"Kurt Russell, Patricia Clarkson, Noah Emmerich, Sean McCann",English,"Canada, USA",2 wins & 4 nominations.,68,7.5,"45,667"
tt0157996,Miracle at Midnight,A Danish family tries to help their Jewish neighbours escape from the Nazis.,movie,N/A,1998,17 May 1998,"November 12, 2019",90 min,Drama,Ken Cameron,"Chris Bryant, Monte Merrick","Sam Waterston, Mia Farrow, Justin Whalin, Patrick Malahide",English,USA,3 wins & 1 nomination.,N/A,7.0,293
tt0218440,Miracle in Lane 2,"Based on a true story, a 13-year-old boy who uses a wheelchair is determined to win a trophy like his athletic older brother.",movie,G,2000,13 May 2000,"November 12, 2019",120 min,"Biography, Comedy, Drama, Family, Sport",Greg Beeman,"Joel Kauffmann, Donald C. Yost","Frankie Muniz, Rick Rossovich, Molly Hagan, Patrick Levis",English,USA,3 wins & 3 nominations.,N/A,6.0,"1,835"
tt3067436,Miracle Landing on the Hudson,"In 2009, just two minutes into US Airways flight 1549, a flock of birds struck the plane taking out both engines. With no power, the Captain decided to attempt the near impossible - to land it in New York's Hudson River.",movie,N/A,2014,05 Jan 2014,"November 12, 2019",90 min,Drama,Simon George,Simon George,"Kate Steavenson-Payne, Sara Stewart, Matthew Douglas, Todd Boyce",English,USA,N/A,N/A,6.7,67
tt0039628,Miracle on 34th Street,"When a nice old man who claims to be Santa Claus is institutionalized as insane, a young lawyer decides to defend him by arguing in court that he is the real thing.",movie,Not Rated,1947,02 Oct 1947,"November 12, 2019",96 min,"Comedy, Drama, Family",George Seaton,"George Seaton (written for the screen by), Valentine Davies (story)","Maureen O'Hara, John Payne, Edmund Gwenn, Gene Lockhart","English, Dutch",USA,Won 3 Oscars. Another 5 wins & 1 nomination.,88,7.9,"38,715"
tt9165688,Mission to the Sun,"A look at NASA's Parker Solar Probe, which launched its mission to explore the sun in August 2018.",movie,N/A,2018,19 Nov 2018,"November 12, 2019",60 min,Documentary,Daniel M. Smith,N/A,"Henry Goodman, Jack Baker, Jeffrey Johnson",English,USA,N/A,N/A,7.1,51
tt3521164,Moana,"In Ancient Polynesia, when a terrible curse incurred by the Demigod Maui reaches Moana's island, she answers the Ocean's call to seek out the Demigod to set things right.",movie,PG,2016,23 Nov 2016,"November 12, 2019",107 min,"Animation, Adventure, Comedy, Family, Fantasy, Musical","Ron Clements, John Musker, Don Hall(co-director), Chris Williams(co-director)","Jared Bush (screenplay by), Ron Clements (story by), John Musker (story by), Chris Williams (story by), Don Hall (story by), Pamela Ribon (story by), Aaron Kandell (story by), Jordan Kandell (story by)","Auli'i Cravalho, Dwayne Johnson, Rachel House, Temuera Morrison",English,USA,Nominated for 2 Oscars. Another 20 wins & 86 nominations.,81,7.6,"250,176"
tt0250593,Mom's Got a Date with a Vampire,"The Hansen kids are in a jam. Adam and his best friend Duffy have gotten their hands on some tickets for the Headless Horseman concert, and his sister Chelsea has a date with her dreamy ...",movie,TV-PG,2000,13 Oct 2000,"November 12, 2019",85 min,"Comedy, Family, Fantasy, Horror",Steve Boyum,"Lindsay Naythons (story), Robert Keats (teleplay)","Matt O'Leary, Laura Vandervoort, Myles Jeffrey, Caroline Rhea",English,"Canada, USA",1 win & 3 nominations.,N/A,5.9,"3,300"
tt1453405,Monsters University,"A look at the relationship between Mike Wazowski (Billy Crystal) and James P. ""Sully"" Sullivan (John Goodman) during their days at Monsters University, when they weren't necessarily the best of friends.",movie,G,2013,21 Jun 2013,"November 12, 2019",104 min,"Animation, Adventure, Comedy, Family, Fantasy",Dan Scanlon,"Dan Scanlon (story by), Daniel Gerson (story by), Robert L. Baird (story by), Daniel Gerson (screenplay by), Robert L. Baird (screenplay by), Dan Scanlon (screenplay by)","Billy Crystal, John Goodman, Steve Buscemi, Helen Mirren",English,USA,Nominated for 1 BAFTA Film Award. Another 9 wins & 57 nominations.,65,7.3,"308,588"
tt0198781,"Monsters, Inc.","In order to power the city, monsters have to scare children so that they scream. However, the children are toxic to the monsters, and after a child gets through, 2 monsters realize things may not be what they think.",movie,G,2001,02 Nov 2001,"November 12, 2019",92 min,"Animation, Adventure, Comedy, Family, Fantasy","Pete Docter, David Silverman(co-director), Lee Unkrich(co-director)","Pete Docter (original story by), Jill Culton (original story by), Jeff Pidgeon (original story by), Ralph Eggleston (original story by), Andrew Stanton (screenplay by), Daniel Gerson (screenplay by)","John Goodman, Billy Crystal, Mary Gibbs, Steve Buscemi",English,USA,Won 1 Oscar. Another 14 wins & 38 nominations.,79,8.0,"779,728"
tt0273842,Motocrossed,A young girl secretly poses as her twin brother to win the big motocross race for him after he breaks his leg.,movie,TV-G,2001,16 Feb 2001,"November 12, 2019",110 min,"Action, Adventure, Family",Steve Boyum,"Ann Austen, Douglas Sloan","Alana Austin, Riley Smith, Mary-Margaret Humes, Trever O'Brien",English,USA,3 nominations.,N/A,6.6,"4,203"
tt0091566,Mr. Boogedy,"A novelty-salesman moves his family into a new house. Initially dismissing incidents as more of their father's practical jokes, the family soon learns that the house is haunted by people who lived in the house 300 years previously.",episode,TV-PG,1986,20 Apr 1986,"November 12, 2019",46 min,"Adventure, Drama, Family",Oz Scott,Michael Janover,"Richard Masur, Mimi Kennedy, Benji Gregory, David Faustino",English,USA,2 nominations.,N/A,7.3,1173
tt0032814,Mr. Duck Steps Out,"Donald is headed for Daisy. However, his nephews are too.",movie,TV-G,1940,07 Jun 1940,"November 12, 2019",8 min,"Animation, Short, Comedy",Jack King,N/A,Clarence Nash,English,USA,N/A,N/A,7.5,511
tt0032815,Mr. Mouse Takes a Trip,"Mickey is heading out on vacation from Burbank to Pomona, taking the train. The conductor, Pete, won't let him on with Pluto, so he hides Pluto in his suitcase, and tries to hide him all ...",movie,N/A,1940,01 Nov 1940,"November 12, 2019",8 min,"Family, Animation, Comedy",Clyde Geronimi,N/A,"Billy Bletcher, Walt Disney, Lee Millar",English,USA,N/A,N/A,7.2,557
tt0120762,Mulan,"To save her father from death in the army, a young maiden secretly goes in his place and becomes one of China's greatest heroines in the process.",movie,G,1998,19 Jun 1998,"November 12, 2019",88 min,"Animation, Adventure, Family, Fantasy, Musical, War","Tony Bancroft, Barry Cook","Robert D. San Souci (based on a story by), Rita Hsiao (screenplay by), Chris Sanders (screenplay by), Philip LaZebnik (screenplay by), Raymond Singer (screenplay by), Eugenia Bostwick-Singer (screenplay by), Dean DeBlois (story co-head), John Sanford (story), Chris Williams (story), Tim Hodge (story), Julius Aguimatang (story), Burny Mattinson (story), Lorna Cook (story), Barry Johnson (story), Thom Enriquez (story), Ed Gombert (story), Joe Grant (story), Floyd Norman (story), Linda Woolverton (additional story material), Jodi Ann Johnson (additional story material), Alan Ormsby (additional story material), David Reynolds (additional story material), Don Dougherty (additional story material), Jorgen Klubien (additional story material), Denis Rich (additional story material), Joe Ekers (additional story material), Theodore Newton (additional story material), Larry Scholl (additional story material), Daan Jippes (additional story material), Frank Nissen (additional story material), Jeff Snow (additional story material)","Miguel Ferrer, Harvey Fierstein, Freda Foh Shen, June Foray","English, Mandarin",USA,Nominated for 1 Oscar. Another 17 wins & 20 nominations.,71,7.6,"237,755"
tt0279967,Mulan II,"While preparing for their wedding, Shang and Mulan are suddenly sent off on a secret mission. Mushu starts to meddle, and a surprise attack by Mongolians doesn't help either.",movie,G,2004,17 Dec 2004,"November 12, 2019",79 min,"Animation, Action, Comedy, Family, Musical","Darrell Rooney, Lynne Southerland","Michael Lucker (screenplay), Chris Parker (screenplay), Roger S.H. Schulman (screenplay)","Ming-Na Wen, BD Wong, Mark Moseley, Lucy Liu",English,"USA, South Korea, Singapore, Russia, Malaysia, Kazakhstan, Taiwan, Hong Kong, Japan, China, India, Syria, Iran, Egypt, Pakistan",1 nomination.,N/A,5.7,"20,851"
tt6337766,Muppet Babies,Baby versions of Jim Henson's famous Muppet characters go on wacky adventures through their imaginations,series,TV-Y,2018–,23 Mar 2018,"November 12, 2019",23 min,"Animation, Short, Adventure, Comedy, Family, Fantasy, Musical",N/A,N/A,"Dee Bradley Baker, Eric Bauza, Matt Danner, Jessica DiCicco",N/A,"South Korea, USA, China, Japan",1 win & 6 nominations.,N/A,7.0,329
,,,,,,,"January 15, 2020",,,,,,,,,,,
tt4555736,Muppet Moments,N/A,series,N/A,2015–,03 Apr 2015,"November 12, 2019",N/A,"Short, Family",N/A,N/A,"Bill Barretta, Dave Goelz, Eric Jacobson, Steve Whitmire",English,USA,N/A,N/A,8.8,6
tt0117110,Muppet Treasure Island,The Muppets' twist on the classic tale.,movie,G,1996,16 Feb 1996,"November 12, 2019",99 min,"Action, Adventure, Comedy, Family, Musical, Romance","Brian Henson, David Lane","Robert Louis Stevenson (novel), Jerry Juhl (screenplay), Kirk R. Thatcher (screenplay), James V. Hart (screenplay)","Tim Curry, Billy Connolly, Jennifer Saunders, Kevin Bishop",English,USA,5 nominations.,64,7.0,"20,293"
tt2281587,Muppets Most Wanted,"While on a grand world tour, The Muppets find themselves wrapped into an European jewel-heist caper headed by a Kermit the Frog look-alike and his dastardly sidekick.",movie,PG,2014,21 Mar 2014,"November 12, 2019",107 min,"Adventure, Comedy, Crime, Family, Musical, Mystery",James Bobin,"James Bobin, Nicholas Stoller, Jim Henson (based on)","Ricky Gervais, Ty Burrell, Tina Fey, Steve Whitmire","English, German",USA,3 wins & 11 nominations.,61,6.4,"30,336"
tt0064705,"My Dog, the Thief: Part 1",An air-traffic reporter discovers that his partner--a St. Bernard dog--has accidentally swiped a priceless necklace from a jewel-smuggling gang.,episode,N/A,1969,21 Sep 1969,"February 14, 2020",88 min,"Adventure, Biography, Drama, Family, Western",Robert Stevenson,"William Raynor (teleplay), Myles Wilder (teleplay), Gordon Buford (based on a story by)","Dwayne Hickman, Mary Ann Mobley, Elsa Lanchester, Joe Flynn",English,USA,N/A,N/A,6.6,77
tt0120764,My Favorite Martian,A Martian lands on Earth and makes friends with a reporter.,movie,PG,1999,12 Feb 1999,"November 12, 2019",94 min,"Comedy, Family, Sci-Fi",Donald Petrie,"John L. Greene (television series My Favorite Martian), Sherri Stoner, Deanna Oliver","Christopher Lloyd, Jeff Daniels, Elizabeth Hurley, Daryl Hannah",English,USA,3 nominations.,33,5.1,"12,448"
tt0805905,My Friends Tigger & Pooh,A girl and her dog have adventures with tigger and pooh in the hundred acre woods,series,TV-Y,2007–2010,12 May 2007,"November 12, 2019",30 min,"Animation, Short, Adventure, Family",N/A,N/A,"Angelica Bolognesi Bonacini, Kimberlea Berg, Jim Cummings, Chloë Grace Moretz","English, Spanish, German, Japanese, French, Abkhazian, Portuguese",USA,1 win & 9 nominations.,N/A,5.7,363
tt0368891,National Treasure,A historian races to find the legendary Templar Treasure before a team of mercenaries.,movie,PG,2004,19 Nov 2004,"April 30, 2020",131 min,"Action, Adventure, Mystery, Thriller",Jon Turteltaub,"Jim Kouf (screenplay), Cormac Wibberley (screenplay), Marianne Wibberley (screenplay), Jim Kouf (story), Oren Aviv (story), Charles Segars (story)","Nicolas Cage, Diane Kruger, Justin Bartha, Sean Bean","English, Spanish",USA,1 win & 9 nominations.,39,6.8,"295,236"
