imdb_id,title,plot,type,rated,year,released_at,added_at,runtime,genre,director,writer,actors,language,country,awards,metascore,imdb_rating,imdb_votes
tt0058056,Emil and the Detectives,Emil goes to Berlin to see his grandmother with a large amount of money and is offered sweets by a strange man that make him sleep. He wakes up at his stop with no money. It is up to him and a group of children to save the day.,movie,PG,1964,18 Dec 1964,"November 12, 2019",99 min,"Comedy, Family, Drama, Crime",Peter Tewksbury,"AJ Carothers, Erich Kästner (novel)","Walter Slezak, Bryan Russell, Roger Mobley, Heinz Schubert",English,USA,N/A,N/A,6.2,390
tt0416716,Empire of Dreams: The Story of the 'Star Wars' Trilogy,"An in-depth making of documentary about the original Star Wars trilogy, covering the productions of the three films and their impact on popular culture.",movie,N/A,2004,20 Sep 2004,"November 12, 2019",151 min,"Documentary, History, Sci-Fi","Edith Becker, Kevin Burns",Ed Singer,"Robert Clotworthy, Walter Cronkite, George Lucas, Steven Spielberg",English,USA,Nominated for 1 Primetime Emmy. Another 1 win.,N/A,8.3,"3,772"
tt7759016,Encore!,"Executive producer Kristen Bell, who also appears, reunites the cast of a high school musical and asks them to perform it again years later. Each former student reprises their role from ...",series,TV-PG,2019–,12 Nov 2019,"November 12, 2019",N/A,"Musical, Reality-TV",N/A,N/A,"Kristen Bell, Matt Fowler, Adam Wachter",English,USA,N/A,N/A,7.2,235
tt0072951,Escape to Witch Mountain,Two mysterious orphan children have extraordinary powers and are chased by a scheming millionaire. But where do these kids really call home?,movie,G,1975,21 Mar 1975,"November 12, 2019",97 min,"Adventure, Family, Fantasy, Mystery, Sci-Fi",John Hough,"Robert Malcolm Young (screenplay by), Alexander Key (based on the book by)","Eddie Albert, Ray Milland, Donald Pleasence, Kim Richards",English,USA,N/A,60,6.4,"8,810"
tt0206511,Even Stevens,"The misadventures of the Stevens family of five in Sacramento, California.",series,TV-G,2000–2003,17 Jun 2000,"November 12, 2019",30 min,"Comedy, Family",N/A,Matt Dearborn,"Shia LaBeouf, Christy Carlson Romano, Nick Spano, Tom Virtue",English,USA,6 wins & 20 nominations.,N/A,7.6,"13,163"
tt10719984,Expedition Amelia,Deep-sea explorer Dr. Robert Ballard attempts to solve the mystery of Amelia Earhart's disappearance in an effort to end speculation about what actually happened to her.,movie,N/A,2019,20 Oct 2019,"December 1, 2019",N/A,N/A,N/A,Chad Cohen,"Robert Ballard, Fredrik T. Hiebert",N/A,USA,N/A,N/A,6.9,10
tt6279452,Expedition Mars,"Expedition Mars brings to life one of the greatest sagas of the Space Age, the epic adventures of Spirit and Opportunity, the rovers that saved NASA's Mars program after a string of failures in the 1990's.",movie,N/A,2016,16 Nov 2016,"November 12, 2019",88 min,Documentary,N/A,N/A,"John Callas, Jake Matijevic, Steve Squyres",English,USA,N/A,N/A,8.1,18
tt6974848,Disney's Fairy Tale Weddings,"Viewers get a behind-the-scenes look at the magical weddings and one-of-a-kind engagements that take place at Disney Destinations around the globe, including Walt Disney World, Disneyland, ...",series,N/A,2017–,11 Dec 2017,"November 12, 2019",63 min,Reality-TV,N/A,"Jenny Daly, Simon Lythgoe, Ann Lewis Roberts","Stephen Boss, Allison Holker",English,USA,1 win.,N/A,7.2,47
tt0032455,Fantasia,A collection of animated interpretations of great works of Western classical music.,movie,G,1940,21 Jul 1941,"November 12, 2019",125 min,"Animation, Family, Fantasy, Music","James Algar, Samuel Armstrong, Ford Beebe Jr., Norman Ferguson, David Hand, Jim Handley, T. Hee, Wilfred Jackson, Hamilton Luske, Bill Roberts, Paul Satterfield, Ben Sharpsteen","Joe Grant (story direction), Dick Huemer (story direction), Lee Blair (story development), Elmer Plummer (story development), Phil Dike (story development), Sylvia Moberly-Holland (story development), Norman Wright (story development), Albert Heath (story development), Bianca Majolie (story development), Graham Heid (story development), Perce Pearce (story development), Carl Fallberg (story development), William Martin (story development and research), Leo Thiele (story development and research), Robert Sterner (story development and research), John McLeish (story development and research), Otto Englander (story development), Webb Smith (story development), Erdman Penner (story development), Joseph Sabo (story development), Bill Peet (story development), Vernon Stallings (story development), Campbell Grant (story development), Arthur Heinemann (story development), Phil Dike (story development)","Deems Taylor, Leopold Stokowski, The Philadelphia Orchestra",English,USA,8 wins & 1 nomination.,96,7.8,"84,999"
tt0120910,Fantasia 2000,An update of the original film with new interpretations of great works of classical music.,movie,G,1999,16 Jun 2000,"November 12, 2019",75 min,"Animation, Comedy, Family, Fantasy, Music","James Algar, Gaëtan Brizzi, Paul Brizzi, Hendel Butoy, Francis Glebas, Eric Goldberg, Don Hahn, Pixote Hunt","Eric Goldberg (story), Joe Grant (original concept), Perce Pearce (story development), Carl Fallberg (story development), Gaëtan Brizzi (story), Paul Brizzi (story), Don Hahn, David Reynolds, Irene Mecchi, Brenda Chapman (original concept), Elena Driskill (concept for ""Death & Re-birth of the Forest"")","Steve Martin, Itzhak Perlman, Quincy Jones, Bette Midler",English,USA,4 wins & 7 nominations.,59,7.2,"33,785"
tt0187635,Fantastic Four: The Animated Series,The adventures of Marvel Comic's greatest superhero team.,series,N/A,1994–1996,24 Sep 1994,"November 12, 2019",22 min,"Animation, Action, Sci-Fi",N/A,"Stan Lee, Jack Kirby","Beau Weaver, Lori Alan, Chuck McCann, Quinton Flynn",English,USA,N/A,N/A,6.4,"2,886"
tt0830298,Fantastic Four: World's Greatest Heroes,The adventures of the Marvel Universe's premiere superhero family.,series,N/A,2006–2010,N/A,"November 12, 2019",30 min,"Animation, Action, Family, Sci-Fi",N/A,N/A,"Hiro Kanagawa, Lara Gilchrist, Christopher Jacot, Brian Dobson",English,USA,N/A,N/A,6.8,"1,921"
tt0030128,Ferdinand the Bull,"Little Ferdinand the bull is stung by a bumblebee when men come to pick a bull for a fight. When he gets in the arena, all he cares about are the flowers in the matador's hands.",movie,Approved,1938,25 Nov 1938,"November 12, 2019",8 min,"Animation, Short, Comedy, Family",Dick Rickard,"Munro Leaf (story), Robert Lawson (story)",Don Wilson,English,USA,N/A,N/A,7.2,"2,254"
tt2277860,Finding Dory,"Friendly but forgetful blue tang Dory begins a search for her long-lost parents, and everyone learns a few things about the real meaning of family along the way.",movie,PG,2016,17 Jun 2016,"November 12, 2019",97 min,"Animation, Adventure, Comedy, Family","Andrew Stanton, Angus MacLane(co-director)","Andrew Stanton (original story by), Andrew Stanton (screenplay by), Victoria Strouse (screenplay by)","Ellen DeGeneres, Albert Brooks, Ed O'Neill, Kaitlin Olson","English, Indonesian",USA,Nominated for 1 BAFTA Film Award. Another 17 wins & 45 nominations.,77,7.3,"227,414"
tt0266543,Finding Nemo,"After his son is captured in the Great Barrier Reef and taken to Sydney, a timid clownfish sets out on a journey to bring him home.",movie,G,2003,30 May 2003,"November 12, 2019",100 min,"Animation, Adventure, Comedy, Family","Andrew Stanton, Lee Unkrich(co-director)","Andrew Stanton (original story by), Andrew Stanton (screenplay by), Bob Peterson (screenplay by), David Reynolds (screenplay by)","Albert Brooks, Ellen DeGeneres, Alexander Gould, Willem Dafoe",English,"USA, Australia",Won 1 Oscar. Another 49 wins & 62 nominations.,90,8.1,"911,647"
,,,,,,,"January 1, 2020",,,,,,,,,,,
tt0116311,First Kid,"A former boxer turned Secret Service agent is assigned to protect the President's son, who seems determined to make life difficult for his new protector.",movie,PG,1996,30 Aug 1996,"November 12, 2019",101 min,"Family, Comedy",David Mickey Evans,Tim Kelleher,"Sinbad, Brock Pierce, Blake Boyd, Timothy Busfield",English,USA,1 nomination.,48,5.2,"9,855"
tt1725902,Fish Hooks,Three friends attend a school for fish submerged in a pet shop.,series,TV-G,2010–2014,28 Aug 2010,"April 3, 2020",22 min,"Animation, Adventure, Comedy, Family",N/A,"Noah Jones, Alex Hirsch, William Reiss","Chelsea Kane, Justin Roiland, Kyle Massey",English,USA,2 wins & 1 nomination.,N/A,4.6,"2,882"
tt0091059,Flight of the Navigator,"In 1978, a boy travels 8 years into the future and has an adventure with an intelligent, wisecracking alien ship.",movie,PG,1986,01 Aug 1986,"November 12, 2019",90 min,"Adventure, Comedy, Family, Sci-Fi",Randal Kleiser,"Mark H. Baker (story), Michael Burton (screenplay), Phil Joanou (screenplay)","Joey Cramer, Paul Reubens, Cliff De Young, Veronica Cartwright",English,USA,4 nominations.,64,6.9,"42,322"
tt9536846,Float,"A father discovers that his son floats, which makes him different from other kids. To keep them both safe from the judgment of the world, Dad hides, covers, and grounds him. But when his son's ability becomes public, Dad must decide whether to run and hide or to accept his son as he is.",movie,PG,2019,12 Nov 2019,"November 12, 2019",7 min,"Animation, Short, Family, Fantasy",Bobby Rubio,Bobby Rubio,"Eli Fucile, Mika Kubo, Bobby Rubio, Luna Watson",English,USA,N/A,N/A,7.4,"1,031"
tt0022899,Flowers and Trees,"An evil tree stump, jealous of two trees in love, starts a forest fire.",movie,APPROVED,1932,30 Jul 1932,"November 12, 2019",8 min,"Animation, Short, Comedy",Burt Gillett,N/A,"Esther Campbell, Marion Darlington",English,USA,N/A,N/A,7.5,"1,547"
tt0119137,Flubber,"An absent-minded professor discovers ""flubber,"" a rubber-like super-bouncy substance.",movie,PG,1997,26 Nov 1997,"November 12, 2019",93 min,"Comedy, Family, Sci-Fi",Les Mayfield,"Samuel W. Taylor (short story ""A Situation of Gravity""), John Hughes (screenplay), Bill Walsh (screenplay)","Robin Williams, Marcia Gay Harden, Christopher McDonald, Ted Levine",English,USA,3 wins & 2 nominations.,37,5.3,"81,512"
,,,,,,,"November 12, 2019",,,,,,,,,,,
tt0248808,For the Birds,A group of snooty birds roosting on a telephone wire get their just deserts when a goofy bird drops in.,movie,G,2000,02 Nov 2001,"November 12, 2019",3 min,"Animation, Short, Comedy, Family",Ralph Eggleston,Ralph Eggleston,Ralph Eggleston,None,USA,Won 1 Oscar. Another 5 wins & 2 nominations.,N/A,8.0,"28,126"
,,,,,,,"December 13, 2019",,,,,,,,,,,
,,,,,,,"November 15, 2019",,,,,,,,,,,
,,,,,,,"December 20, 2019",,,,,,,,,,,
,,,,,,,"December 27, 2019",,,,,,,,,,,
,,,,,,,"November 22, 2019",,,,,,,,,,,
tt11194650,What is Cheese?,Buttercup takes Forky on a whirlwind ride in an effort to answer any questions he may have.,episode,N/A,2020,03 Jan 2020,"January 3, 2020",3 min,"Animation, Comedy, Family",Bob Peterson,Bob Peterson,"Tony Hale, Jeff Garlin, Bob Peterson",N/A,N/A,N/A,N/A,7.8,26
,,,,,,,"December 6, 2019",,,,,,,,,,,
,,,,,,,"November 12, 2019",,,,,,,,,,,
tt11194652,What is Reading?,Forky asks the Peas-in-a-Pod about reading and Mr. Spell offers his help as well.,episode,N/A,2020,10 Jan 2020,"January 10, 2020",3 min,"Animation, Comedy, Family",Bob Peterson,Bob Peterson,"Tony Hale, Addison Andrews, Mila Crespo, Imani Prior",N/A,N/A,N/A,N/A,8.1,32
,,,,,,,"November 29, 2019",,,,,,,,,,,
tt0113104,Frank and Ollie,"A documentary about two famed Disney animators, Frank and Ollie.",movie,PG,1995,20 Oct 1995,"November 12, 2019",89 min,Documentary,Theodore Thomas,Theodore Thomas,"Frank Thomas, Ollie Johnston, Sylvia Roemer, John Canemaker",English,USA,1 win.,N/A,7.8,524
tt1142977,Frankenweenie,"When a boy's beloved dog passes away suddenly, he attempts to bring the animal back to life through a powerful science experiment.",movie,PG,2012,05 Oct 2012,"April 1, 2020",87 min,"Animation, Comedy, Family, Horror, Sci-Fi",Tim Burton,"Leonard Ripps, Tim Burton (original idea), John August (screenplay)","Catherine O'Hara, Martin Short, Martin Landau, Charlie Tahan",English,USA,Nominated for 1 Oscar. Another 11 wins & 49 nominations.,74,6.9,"94,078"
tt0087291,Frankenweenie,A young boy sets out to revive his dead pet using the monstrous power of science.,movie,PG,1984,21 Dec 1984,"November 12, 2019",29 min,"Short, Comedy, Drama, Sci-Fi",Tim Burton,"Tim Burton (based on an original idea by), Leonard Ripps (screenplay)","Shelley Duvall, Daniel Stern, Barret Oliver, Joseph Maher",English,USA,1 nomination.,N/A,7.3,"10,736"
tt0076054,Freaky Friday,A mother and daughter find their personalities switched and have to live each other's lives on one strange Friday.,movie,G,1976,21 Jan 1977,"November 12, 2019",95 min,"Comedy, Family, Fantasy",Gary Nelson,"Mary Rodgers (screenplay), Mary Rodgers (book)","Barbara Harris, Jodie Foster, John Astin, Patsy Kelly",English,USA,N/A,51,6.3,"11,109"
tt0322330,Freaky Friday,"An overworked mother and her daughter do not get along. When they switch bodies, each is forced to adapt to the other's life for one freaky Friday.",movie,PG,2003,06 Aug 2003,"November 12, 2019",97 min,"Comedy, Family, Fantasy, Music, Romance",Mark Waters,"Mary Rodgers (novel), Heather Hach (screenplay), Leslie Dixon (screenplay)","Jamie Lee Curtis, Lindsay Lohan, Mark Harmon, Harold Gould","English, Mandarin",USA,Nominated for 1 Golden Globe. Another 5 wins & 10 nominations.,70,6.1,"120,172"
tt7631348,Freaky Friday,"A musical about what happens when a mom and daughter argue, get their bodies magically switched, and have to make it through the day being the other at high school or preparing for the wedding next day - while hoping to switch back.",movie,TV-G,2018,10 Aug 2018,"November 12, 2019",90 min,"Comedy, Fantasy, Musical",Steve Carr,"Bridget Carpenter (musical book), Bridget Carpenter (screenplay), Mary Rodgers (based on a children's book by), Brian Yorkey (musical book)","Cozi Zuehlsdorff, Heidi Blickenstaff, Jason Maybaum, Alex Désert",English,USA,N/A,N/A,3.7,916
tt7775622,Free Solo,Alex Honnold attempts to become the first person to ever free solo climb El Capitan.,movie,PG-13,2018,13 Dec 2018,"November 12, 2019",100 min,"Documentary, Adventure, Sport","Jimmy Chin, Elizabeth Chai Vasarhelyi",N/A,"Alex Honnold, Tommy Caldwell, Jimmy Chin, Cheyne Lempe",English,USA,Won 1 Oscar. Another 29 wins & 54 nominations.,83,8.2,"46,710"
tt1865368,Frenemies,Three sets of friends deal with the ups and downs of their ever-changing relationships.,movie,TV-G,2012,13 Jan 2012,"November 12, 2019",87 min,"Comedy, Drama, Family",Daisy von Scherler Mayer,"Alexa Young (based on a novel by), Dava Savel (teleplay), Wendy Weiner (teleplay), Dava Savel (teleplay), James Krieg (teleplay), James Krieg (television story), Dava Savel (television story)","Bella Thorne, Zendaya, Mary Mouser, Nick Robinson",English,USA,3 nominations.,N/A,5.0,"3,969"
tt2294629,Frozen,"When the newly crowned Queen Elsa accidentally uses her power to turn things into ice to curse her home in infinite winter, her sister Anna teams up with a mountain man, his playful reindeer, and a snowman to change the weather condition.",movie,PG,2013,27 Nov 2013,"November 12, 2019",102 min,"Animation, Adventure, Comedy, Family, Fantasy, Musical","Chris Buck, Jennifer Lee","Jennifer Lee (screenplay by), Hans Christian Andersen (story inspired by: ""The Snow Queen"" by), Chris Buck (story by), Jennifer Lee (story by), Shane Morris (story by)","Kristen Bell, Idina Menzel, Jonathan Groff, Josh Gad","English, Norwegian",USA,Won 2 Oscars. Another 79 wins & 59 nominations.,75,7.5,"551,637"
tt4520988,Frozen II,"Anna, Elsa, Kristoff, Olaf and Sven leave Arendelle to travel to an ancient, autumn-bound forest of an enchanted land. They set out to find the origin of Elsa's powers in order to save their kingdom.",movie,PG,2019,22 Nov 2019,"March 14, 2020",103 min,"Animation, Adventure, Comedy, Family, Fantasy, Musical","Chris Buck, Jennifer Lee","Jennifer Lee (screenplay by), Hans Christian Andersen (story inspired by ""The Snow Queen"" by), Jennifer Lee (story by), Chris Buck (story by), Kristen Anderson-Lopez (story by), Robert Lopez (story by), Marc Smith (story by), Allison Schroeder (additional screenplay material by)","Kristen Bell, Idina Menzel, Josh Gad, Jonathan Groff",English,USA,Nominated for 1 Oscar. Another 15 wins & 71 nominations.,64,7.0,"106,368"
tt0382142,Full-Court Miracle,"An African American college basketball star becomes the head coach of a yeshiva's struggling basketball team in Philadelphia, Pennsylvania, after a knee injury forces him to leave the game. Based on the true story of Lamont Carr.",movie,TV-G,2003,21 Nov 2003,"November 12, 2019",90 min,"Drama, Family, Sport",Stuart Gillard,"Joel Silverman, Joel Kauffmann, Donald C. Yost","Alex D. Linz, Richard T. Jones, R.H. Thomson, Sean Marquette",English,USA,4 nominations.,N/A,5.7,816
tt0039404,Fun and Fancy Free,"Jiminy Cricket hosts two Disney animated shorts: ""Bongo,"" about a circus bear escaping to the wild, and ""Mickey and the Beanstalk,"" a take on the famous fairy tale.",movie,Approved,1947,12 Mar 1948,"November 12, 2019",73 min,"Animation, Adventure, Comedy, Family, Fantasy, Musical, Romance","Jack Kinney, Hamilton Luske, William Morgan, Bill Roberts","Homer Brightman (story), Harry Reeves (story), Ted Sears (story), Lance Nolley (story), Eldon Dedini (story), Tom Oreb (story), Sinclair Lewis (from an original story by)","Edgar Bergen, Dinah Shore, Luana Patten, Anita Gordon",English,USA,N/A,66,6.6,"6,454"
tt0286639,Fuzzbucket,"In the vein of ""Harvey"", an invisible creature befriends a 12 year old boy. Of course, no one else can see him nor believes in him.",movie,N/A,1986,18 May 1986,"November 12, 2019",46 min,"Adventure, Comedy, Family",Mick Garris,Mick Garris,"Chris Hebert, Phil Fondacaro, Joe Regalbuto, Wendy Phillips",English,USA,1 nomination.,N/A,7.6,155
tt0436339,G-Force,A specially trained squad of guinea pigs is dispatched to stop a diabolical billionaire from taking over the world.,movie,PG,2009,24 Jul 2009,"March 15, 2020",88 min,"Action, Adventure, Comedy, Family, Fantasy, Sci-Fi",Hoyt Yeatman,"Cormac Wibberley (screenplay), Marianne Wibberley (screenplay), Hoyt Yeatman (story), David P.I. James (story)","Bill Nighy, Will Arnett, Zach Galifianakis, Kelli Garner","Spanish, English",USA,1 win & 1 nomination.,41,5.1,"41,151"
tt0108783,Gargoyles,A clan of heroic night creatures pledge to protect modern New York City as they did in Scotland one thousand years earlier.,series,TV-PG,1994–1996,24 Oct 1994,"November 12, 2019",30 min,"Animation, Action, Adventure, Comedy, Crime, Drama, Family, Fantasy, Mystery, Romance, Thriller",N/A,Greg Weisman,"Keith David, Salli Richardson-Whitfield, Jeff Bennett, Frank Welker",English,USA,1 win & 11 nominations.,N/A,8.1,"13,699"
tt1835977,Geek Charming,"To win a school popularity contest, a high school diva permits a film club classmate to record her popular life, but the film starts documenting her decline instead.",movie,TV-G,2011,11 Nov 2011,"November 12, 2019",94 min,"Comedy, Drama, Family, Romance",Jeffrey Hornaday,"Robin Palmer (based on the novel by), Elizabeth Hackett (teleplay), Hilary Galanoy (teleplay)","Sarah Hyland, Matt Prokop, Sasha Pieterse, Jordan Nichols",English,USA,1 nomination.,N/A,6.4,"10,723"
tt0193187,Genius,Charlie Boyle finds that even his high IQ can't solve all of his problems when he takes on a double life in order to make friends his own age.,movie,TV-G,1999,21 Aug 1999,"November 12, 2019",82 min,"Comedy, Family, Romance, Sci-Fi",Rod Daniel,"John Rieck (story), John Rieck (teleplay), Jim Lincoln (teleplay), Dan Studney (teleplay)","Trevor Morgan, Emmy Rossum, Charles Fleischer, Yannick Bisson",English,USA,2 nominations.,N/A,6.3,"1,570"
,,,,,,,"November 12, 2019",,,,,,,,,,,
tt0119190,George of the Jungle,A man raised in the jungle by apes falls in love with a wealthy American heiress.,movie,PG,1997,16 Jul 1997,"May 1, 2020",92 min,"Action, Adventure, Comedy, Family, Romance",Sam Weisman,"Jay Ward (characters), Dana Olsen (story), Dana Olsen (screenplay), Audrey Wells (screenplay)","Brendan Fraser, Leslie Mann, Thomas Haden Church, Richard Roundtree","English, Spanish",USA,1 win & 3 nominations.,53,5.4,"68,409"
tt0322389,George of the Jungle 2,"George, now a father, goes to Las Vegas, where he has to help out his brother.",movie,PG,2003,20 Oct 2003,"December 20, 2019",87 min,"Adventure, Comedy, Family",David Grossman,"Jordan Moffet, Bill Scott (television series), Jay Ward (based upon characters created by)","Christopher Showerman, Julie Benz, Angus T. Jones, Thomas Haden Church",English,"USA, Australia",N/A,N/A,3.3,"6,039"
tt0131409,Geri's Game,Geri sets up a chess game to play his greatest opponent - himself.,movie,N/A,1997,25 Nov 1997,"November 12, 2019",4 min,"Animation, Short, Family",Jan Pinkava,Jan Pinkava,Bob Peterson,None,USA,Won 1 Oscar. Another 8 wins & 1 nomination.,N/A,7.9,"21,679"
tt0282521,Get a Clue,"A wealthy student with too much fashion sense, her equally rich friends, and her rival/superior from the school paper work together to solve the case when their teacher goes missing.",movie,TV-G,2002,20 Jul 2002,"November 12, 2019",83 min,"Comedy, Crime, Family, Mystery",Maggie Greenwald,Alana Sanko,"Lindsay Lohan, Bug Hall, Ian Gomez, Brenda Song",English,USA,N/A,N/A,5.1,"5,713"
,,,,,,,"November 12, 2019",,,,,,,,,,,
tt2543796,Girl Meets World,"More than a decade after Boy Meets World (1993), Cory and Topanga Matthews are married and have two children. Their daughter, Riley, faces life lessons through her family, friends, and school--where her father is her history teacher--as her parents did when they were younger.",series,TV-G,2014–2017,27 Jun 2014,"November 12, 2019",23 min,"Comedy, Drama, Family",N/A,"Michael Jacobs, April Kelly","Rowan Blanchard, Ben Savage, Sabrina Carpenter, Peyton Meyer",English,USA,Nominated for 3 Primetime Emmys. Another 3 wins & 16 nominations.,N/A,7.2,"12,220"
tt0385726,Glory Road,"In 1966, Texas Western coach Don Haskins led the first all-black starting line-up for a college basketball team to the NCAA national championship.",movie,PG,2006,13 Jan 2006,"December 1, 2019",118 min,"Biography, Drama, Sport",James Gartner,"Christopher Cleveland, Bettina Gilois","Josh Lucas, Derek Luke, Austin Nichols, Jon Voight",English,USA,2 wins & 3 nominations.,58,7.2,"41,442"
tt0447987,Go Figure,"A teenager dreams of becoming a champion ice-skater, and soon discovers a top Russian instructor is working at a nearby private school.",movie,TV-G,2005,10 Jun 2005,"November 12, 2019",88 min,"Comedy, Drama, Family, Sport",Francine McDougall,"Patrick J. Clifton, Beth Rigazio","Jordan Danger, Whitney Sloan, Cristine Rose, Ryan Malgarini",English,USA,1 nomination.,N/A,5.7,"3,121"
tt0399104,Going to the Mat,"Jace Newfield has a problem. Besides being blind and being the new kid at school, his problem is that the kids at his new school thinks he's a jerk. Jace has to find a way to be accepted ...",movie,G,2004,19 Mar 2004,"November 12, 2019",120 min,"Drama, Family, Sport",Stuart Gillard,"Chris Nolan (story), Laurie Nolan (story), Chris Nolan (teleplay), Laurie Nolan (teleplay), Steve Bloom (teleplay), Stu Krieger (teleplay)","Andrew Lawrence, Khleo Thomas, Alessandra Torresani, Wayne Brady",English,USA,1 win & 3 nominations.,N/A,6.8,"1,212"
tt1415889,Good Luck Charlie,"The Duncan family are adjusting to the surprise birth of their fourth child, Charlie. When parents Amy and Bob return to work they put their latest addition in the care of her three older siblings.",series,TV-G,2010–2014,04 Apr 2010,"November 12, 2019",22 min,"Comedy, Drama, Family",N/A,"Phil Baker, Drew Vaupen","Bridgit Mendler, Leigh-Allyn Baker, Bradley Steven Perry, Mia Talerico",English,USA,Nominated for 3 Primetime Emmys. Another 4 wins & 20 nominations.,N/A,7.0,"17,475"
tt1828976,"Good Luck Charlie, It's Christmas!",Idiocy strikes when a woman and her daughter get separated from their family during the holidays.,movie,TV-G,2011,02 Dec 2011,"November 12, 2019",90 min,"Comedy, Drama, Family",Arlene Sanford,"Phil Baker (creator), Drew Vaupen (creator), Geoff Rodkey","Bridgit Mendler, Leigh-Allyn Baker, Bradley Steven Perry, Mia Talerico","English, Korean",USA,N/A,N/A,6.4,"4,577"
tt0103428,Goof Troop,"The classic Disney character Goofy is a single father raising his son, Max, in Spoonerville. Pete, a frequent antagonist from the old cartoons, lives next door with his family.",series,TV-Y,1992–1993,05 Sep 1992,"November 12, 2019",30 min,"Animation, Adventure, Comedy, Family, Music",N/A,N/A,"Rob Paulsen, April Winchell, Jim Cummings, Bill Farmer",English,USA,1 win & 2 nominations.,N/A,6.8,"7,293"
tt9165706,Gordon Ramsay: Uncharted,"Globetrotting celebrity chef Gordon Ramsay serves up an epic adventure in ""Gordon Ramsay: Uncharted."" He travels around the world meeting with indigenous people to learn about their foods ...",series,N/A,2019–,21 Jul 2019,"November 12, 2019",60 min,"Adventure, Reality-TV",N/A,N/A,Gordon Ramsay,N/A,N/A,1 nomination.,N/A,7.9,316
tt0299943,Gotta Kick It Up!,A school dance team get a new lease of life thanks to a teacher who lets them in on the secret of Latin rhythms for a big competition.,movie,TV-G,2002,26 Jul 2002,"November 12, 2019",78 min,"Comedy, Drama, Family",Ramón Menéndez,"Meghan Cole (story), Nancy De Los Santos (story), Nancy De Los Santos (teleplay), Ramón Menéndez (teleplay), Tom Musca (teleplay), Stu Krieger (teleplay)","Camille Guaty, America Ferrera, Jhoanna Flores, Suilma Rodriguez",English,USA,2 nominations.,N/A,5.8,"1,551"
,,,,,,,"November 12, 2019",,,,,,,,,,,
